<?xml version="1.0" encoding="UTF-8"?>
<Pizzas xmlns:xsi="http://www.w3.org/2001/XMLSchema-instance"
 xsi:noNamespaceSchemaLocation="Pizzas.xsd">
<Pizza nombre="Margarita" precio="10" vegana="true">
    <Ingrediente nombre= "Tomate"></Ingrediente>
    <Ingrediente nombre= "Oregano"></Ingrediente>
    <Ingrediente nombre= "Pimienta Negra"></Ingrediente>
</Pizza>
<Pizza nombre="Cuatro Estaciones" precio="15" vegana="false">
    <Ingrediente nombre= "Tomate"></Ingrediente>
    <Ingrediente nombre= "Champiñon"></Ingrediente>
    <Ingrediente nombre= "Aceitunas"></Ingrediente>
    <Ingrediente nombre= "Mozzarela"></Ingrediente>
</Pizza>
​<Pizza nombre="Cuatro Quesos" precio="20" vegana="false">
    <Ingrediente nombre= "Roquefort"></Ingrediente>
    <Ingrediente nombre= "Gorgonzola"></Ingrediente>
    <Ingrediente nombre= "Provolone"></Ingrediente>
    <Ingrediente nombre= "Parmesano"></Ingrediente>
</Pizza>
​<Pizza nombre="Diavola" precio="25" vegana="false">
    <Ingrediente nombre= "Mozzarella"></Ingrediente>
    <Ingrediente nombre= "Pepperoni"></Ingrediente>
    <Ingrediente nombre= "Carne"></Ingrediente> 
</Pizza>
</Pizzas>
